Gene/Group,Variant Name,Gene Source,NCBI Gene ID,Gene Full Name,Gene Aliases,Chromosome,Candidate Source,Normalization Applied,Validation Outcome,Dropped By Gate,PMID,DOI,Study Title,Authors,Publication Year,Journal Name,Author Affiliations,Citations,Citation Source,Citation Retrieved At,iCite Citations,Semantic Scholar Citations,Figure Count,Figure Analysis Enabled,Metadata Completeness,Metadata Warnings,Key Finding,Key Finding Citation,Variant,Variant Citation,validation_confidence,validation_source,validation_suggestions,Key Finding_citation_valid,Key Finding_citation_confidence,Key Finding_citation_details,Key Finding Citation_citation_valid,Key Finding Citation_citation_confidence,Key Finding Citation_citation_details,Variant_citation_valid,Variant_citation_confidence,Variant_citation_details,Variant Citation_citation_valid,Variant Citation_citation_confidence,Variant Citation_citation_details,context_flash_fits,context_pro_fits,context_original_tokens,context_modifications,context_truncation_applied
ANK3,rs10994359,both,288,,,,llm_abstract,local_symbol,passed,False,21926974,10.1038/ng.940,Genome-wide association study identifies five new schizophrenia loci.,,2011,Nature genetics,"Center for Human Genetic Research, Massachusetts General Hospital, Boston, Massachusetts, USA.",1583,icite,2026-02-25T18:49:45.275448Z,1583,,2,True,0.8,missing_authors,"e loci reached genome-wide significance: CACNA1C (rs4765905, P = 7.0 x 10 -9 ), ANK3 (rs10994359, P = 2.5 x 10 -8 ) and the ITIH3-ITIH4 region (rs2239547, P = 7.8 x 10 -9 ). In stage 1, we conducted a mega-analysis combining genome-wide...",Auto snippet from paper text,,,1.0,HGNC + variant_dbsnp_rsid,,False,0.0,No citation provided,False,0.0,No citation provided,False,0.0,No citation provided,False,0.0,No citation provided,True,True,5374,No modifications needed,False
CACNA1C,rs4765905,both,775,calcium voltage-gated channel subunit alpha1 C,"CACH2, CACN2, CACNA1C-IT2",12,llm_abstract,local_symbol,passed,False,21926974,10.1038/ng.940,Genome-wide association study identifies five new schizophrenia loci.,,2011,Nature genetics,"Center for Human Genetic Research, Massachusetts General Hospital, Boston, Massachusetts, USA.",1583,icite,2026-02-25T18:49:45.275448Z,1583,,2,True,0.8,missing_authors,"individuals and 14,044 controls), three loci reached genome-wide significance: CACNA1C (rs4765905, P = 7.0 x 10 -9 ), ANK3 (rs10994359, P = 2.5 x 10 -8 ) and the ITIH3-ITIH4 region (rs2239547, P = 7.8 x 10 -9 ). In stage 1, we conducted...",Auto snippet from paper text,,,1.0,HGNC + variant_dbsnp_rsid,,False,0.0,No citation provided,False,0.0,No citation provided,False,0.0,No citation provided,False,0.0,No citation provided,True,True,5374,No modifications needed,False
ITIH3,rs2239547,both,3699,inter-alpha-trypsin inhibitor heavy chain 3,"H3P, ITI-HC3, SHAP",3,llm_abstract,local_symbol,passed,False,21926974,10.1038/ng.940,Genome-wide association study identifies five new schizophrenia loci.,,2011,Nature genetics,"Center for Human Genetic Research, Massachusetts General Hospital, Boston, Massachusetts, USA.",1583,icite,2026-02-25T18:49:45.275448Z,1583,,2,True,0.8,missing_authors,"NA1C (rs4765905, P = 7.0 x 10 -9 ), ANK3 (rs10994359, P = 2.5 x 10 -8 ) and the ITIH3-ITIH4 region (rs2239547, P = 7.8 x 10 -9 ). In stage 1, we conducted a mega-analysis combining genome-wide assocation study (GWAS) data from 17 separat...",Auto snippet from paper text,,,1.0,HGNC + variant_dbsnp_rsid,,False,0.0,No citation provided,False,0.0,No citation provided,False,0.0,No citation provided,False,0.0,No citation provided,True,True,5374,No modifications needed,False
ITIH4,rs2239547,both,3700,,,,llm_abstract,local_symbol,passed,False,21926974,10.1038/ng.940,Genome-wide association study identifies five new schizophrenia loci.,,2011,Nature genetics,"Center for Human Genetic Research, Massachusetts General Hospital, Boston, Massachusetts, USA.",1583,icite,2026-02-25T18:49:45.275448Z,1583,,2,True,0.8,missing_authors,"rs4765905, P = 7.0 x 10 -9 ), ANK3 (rs10994359, P = 2.5 x 10 -8 ) and the ITIH3-ITIH4 region (rs2239547, P = 7.8 x 10 -9 ). In stage 1, we conducted a mega-analysis combining genome-wide assocation study (GWAS) data from 17 separate stud...",Auto snippet from paper text,,,1.0,HGNC + variant_dbsnp_rsid,,False,0.0,No citation provided,False,0.0,No citation provided,False,0.0,No citation provided,False,0.0,No citation provided,True,True,5374,No modifications needed,False
MIR137,rs1625579,both,406928,,,,llm_abstract,local_symbol,passed,False,21926974,10.1038/ng.940,Genome-wide association study identifies five new schizophrenia loci.,,2011,Nature genetics,"Center for Human Genetic Research, Massachusetts General Hospital, Boston, Massachusetts, USA.",1583,icite,2026-02-25T18:49:45.275448Z,1583,,2,True,0.8,missing_authors,"-11 ) was with rs1625579 within an intron of a putative primary transcript for MIR137 (microRNA 137), a known regulator of neuronal development. Four other schizophrenia loci achieving genome-wide significance contain predicted targets o...",Auto snippet from paper text,,,1.0,HGNC + variant_dbsnp_rsid,,False,0.0,No citation provided,False,0.0,No citation provided,False,0.0,No citation provided,False,0.0,No citation provided,True,True,5374,No modifications needed,False
